{
  "meeting_id": "2026-03-28-team-alpha",
  "date": "2026-03-28",
  "timezone": "Europe/Moscow",
  "team": "team-alpha",
  "participants": ["Артем", "Иван", "Мария", "Петр", "Алина"],
  "summary": "Подготовка к релизу. Два блокера: ответ от дизайнера и нестабильный тестовый стенд.",
  "updates": [
    {
      "person": "Иван",
      "done": ["Закрыл TASK-235 (retry logic)"],
      "todo": ["TASK-241 (ретраи вебхуков)"],
      "blockers": [],
      "notes": []
    },
    {
      "person": "Мария",
      "done": ["TASK-230 (UI макеты) в ревью"],
      "todo": ["TASK-233 (UI статусов оплаты)"],
      "blockers": ["Ожидает ответ от дизайнера по цветовой схеме"],
      "notes": []
    },
    {
      "person": "Петр",
      "done": ["TASK-236 (индексы БД)"],
      "todo": ["TASK-238 (миграции billing)"],
      "blockers": [],
      "notes": []
    },
    {
      "person": "Алина",
      "done": ["Написала TASK-240 (smoke-тесты)"],
      "todo": ["TASK-245 (e2e smoke)"],
      "blockers": ["Тестовый стенд нестабилен"],
      "notes": []
    },
    {
      "person": "Артем",
      "done": [],
      "todo": ["Связаться с DevOps по тестовому стенду"],
      "blockers": [],
      "notes": []
    }
  ],
  "decisions": [
    "DevOps починят тестовый стенд до конца дня"
  ],
  "action_items": [
    {
      "task": "Починить тестовый стенд",
      "owner": null,
      "status": "open",
      "due_date": "2026-03-28"
    }
  ],
  "topics": ["Релиз", "UI", "Тестирование"],
  "offtopic": [],
  "jira_issues": [
    {
      "key": "TASK-230",
      "summary": "UI макеты отчётов",
      "status": "In Review",
      "assignee": "Мария",
      "mentioned_as": "TASK-230"
    },
    {
      "key": "TASK-233",
      "summary": "UI статусов оплаты",
      "status": "To Do",
      "assignee": "Мария",
      "mentioned_as": "TASK-233"
    },
    {
      "key": "TASK-235",
      "summary": "Вебхуки: retry logic",
      "status": "Done",
      "assignee": "Иван",
      "mentioned_as": "TASK-235"
    },
    {
      "key": "TASK-236",
      "summary": "Индексы БД для billing",
      "status": "Done",
      "assignee": "Петр",
      "mentioned_as": "TASK-236"
    },
    {
      "key": "TASK-238",
      "summary": "Миграции billing",
      "status": "To Do",
      "assignee": "Петр",
      "mentioned_as": "TASK-238"
    },
    {
      "key": "TASK-240",
      "summary": "Smoke-тесты релизного контура",
      "status": "Done",
      "assignee": "Алина",
      "mentioned_as": "TASK-240"
    },
    {
      "key": "TASK-241",
      "summary": "Ретраи доставки вебхуков",
      "status": "In Progress",
      "assignee": "Иван",
      "mentioned_as": "TASK-241"
    },
    {
      "key": "TASK-245",
      "summary": "E2E smoke",
      "status": "To Do",
      "assignee": "Алина",
      "mentioned_as": "TASK-245"
    }
  ]
}
