{
  "meeting_id": "2026-03-23-team-alpha",
  "date": "2026-03-23",
  "timezone": "Europe/Moscow",
  "team": "team-alpha",
  "participants": ["Иван", "Мария"],
  "summary": "Обсуждение API и перенос релиза",
  "updates": [
    {
      "person": "Иван",
      "done": ["Сделал API"],
      "todo": [],
      "blockers": ["Нет доступа к тестовому сервису"],
      "notes": []
    },
    {
      "person": "Мария",
      "done": ["Проверила макеты"],
      "todo": [],
      "blockers": [],
      "notes": []
    }
  ],
  "decisions": ["Перенос релиза"],
  "action_items": [],
  "topics": ["API", "Релиз"],
  "offtopic": []
}
